{
    "$schema": "https://json-schema.org/draft/2020-12/schema",
    "$id": "calibrations",
    "title": "CalibrationsFile",
    "description": "Json schema for the calibration file used to model the QPU noise",
    "type": "object",
    "properties": 
    {
        "Qubits":
        {
            "description": "Qubits calibrations",
            "type" : "object",
            "properties":
            {
                "type":
                {
                    "type": "object",
                    "properties":
                    {
                        "T1":
                        {
                            "description": "",
                            "type":"number"
                        },
                        "T2e":
                        {
                            "description": "",
                            "type":"number"
                        },
                        "Drive Frequency ":
                        {
                            "description": "",
                            "type":"number"
                        },
                        "Measuring frequency":
                        {
                            "description": "",
                            "type":"number"
                        },
                        "Measuring time":
                        {
                            "description": "",
                            "type":"number"
                        },
                        "Fidelity init":
                        {
                            "description": "",
                            "type":"number"
                        },
                        "Fidelity readout":
                        {
                            "description": "",
                            "type":"number"
                        },
                        "Drive Frequency":
                        {
                            "description": "",
                            "type":"number"
                        },
                        "Readout duration":
                        {
                            "description": "",
                            "type":"number"
                        },
                        "T1 (s)":
                        {
                            "description": "",
                            "type":"number"
                        },
                        "T2 (s)":
                        {
                            "description": "",
                            "type":"number"
                        },
                        "Drive Frequency (Hz)":
                        {
                            "description": "",
                            "type":"number"
                        },
                        "Measuring Frequency (Hz)":
                        {
                            "description": "",
                            "type":"number"
                        },
                        "Readout duration (s)":
                        {
                            "description": "",
                            "type":"number"
                        },
                        "Measuring frequency (Hz)":
                        {   
                            "description": "",
                            "type":"number"
                        },
                        "Readout fidelity(RB)":
                        {
                            "description": "",
                            "type":"number"
                        }
                    }
                }
            }   
        },

        "Q1Gates":
        {
            "description": "Calibrations of one-qubit gates",
            "type": "object",
            "properties":
            {
                "type":
                {
                    "type":"object",
                    "properties":
                    {
                        "type": 
                        {
                            "type": "object",
                            "properties":
                            {
                                "type": 
                                {
                                    "type": "object",
                                    "properties":
                                    {
                                        "duration (ns)":
                                        {
                                            "description": "",
                                            "type":"number"
                                        },
                                        "Fidelity":
                                        {
                                            "description": "",
                                            "type":"number"
                                        },
                                        "Duration (ns)":
                                        {
                                            "description": "",
                                            "type":"number"
                                        },
                                        "Gate duration (s)":
                                        {
                                            "description": "",
                                            "type":"number"
                                        },
                                        "Fidelity(RB)":
                                        {
                                            "description": "",
                                            "type":"number"
                                        }
                                    }
                                }
                            }
                        }
                    }
                }
            }
        },

        "Q2Gates":
        {
            "description": "Calibrations of two-qubits gates",
            "type": "object",
            "properties":
            {
                "type":
                {
                    "type":"object",
                    "properties":
                    {
                        "type": 
                        {
                            "type":"object",
                            "properties":
                            {
                                "Control":
                                {
                                    "description": "",
                                    "type":"integer"
                                },
                                "Target":
                                {
                                    "description": "",
                                    "type":"integer"
                                },
                                "Duration (s)":
                                {
                                    "description": "",
                                    "type":"number"
                                },
                                "Fidelity(RB)":
                                {
                                    "description": "",
                                    "type":"number"
                                }
                            }
                        }
                    }
                }
                
            }
        },

        "Q2Gates(RB)":
        {
            "description": "Calibrations of two-qubits gates",
            "type": "object",
            "properties":
            {
                "type":
                {
                    "type":"object",
                    "properties":
                    {
                        "type": 
                        {
                            "type":"object",
                            "properties":
                            {
                                "Control":
                                {
                                    "description": "",
                                    "type":"integer"
                                },
                                "Target":
                                {
                                    "description": "",
                                    "type":"integer"
                                },
                                "Duration (s)":
                                {
                                    "description": "",
                                    "type":"number"
                                },
                                "Fidelity(RB)":
                                {
                                    "description": "",
                                    "type":"number"
                                }
                            }
                        }
                    }
                }
                
            }
        }
    }
}